patent_id,source,title,date,assignee,abstract,link
GB2575034,EPO,Hybrid vehicle satellite navigation system with integrated contactless payment processing,20200101,MICHAEL OLUWASEUN BAMIDELE [GB],"A hybrid satellite navigation system consisting of a Bluetooth (RTM) transceiver, 5G/6G (or other Internet connection) transceiver and contactless payment transceiver. The hybrid satellite navigation system will work with a new breed of satellites designed to facilitate wireless payment processing via banking systems' servers. The invention relates to the field of contactless payment processing with particular focus on in-car or in-vehicle contactless payment processing. This in-car or in-vehicle contactless payment processing will be facilitated by the satnav screen in the vehicle and will work seamlessly with contactless credit cards and contactless debit cards.",https://worldwide.espacenet.com/publicationDetails/biblio?CC=GB&NR=2575034&KC=A
FR2951863,EPO,"Device for short-circuiting resistor of starter of engine of vehicle to start engine, has external electrodes exposed to outer side of terminal plate, and resistor connected between external electrodes at outer side of terminal plate",20110429,MITSUBISHI ELECTRIC CORP [JP],"The device has an electromagnetic switch placed in a terminal plate. A pair of electromagnetic switch fixed contacts (6e, 6f) and a pair of fixed contacts (5f, 6f) are connected and disconnected with each other by mobile contacts (5d, 6d) of the electromagnetic switch fixed contacts. External electrodes (6g, 6h) are exposed to outer side of the terminal plate. A resistor (7) is connected between the external electrodes at the outer side of the terminal plate.",https://worldwide.espacenet.com/publicationDetails/biblio?CC=FR&NR=2951863&KC=A1
CN209948043,EPO,Compact type high-frequency-ratio double-frequency antenna covering sub-6G and 60GHz,20200114,UNIV SOUTH CHINA TECH,"The utility model discloses a compact large-frequency-ratio double-frequency antenna covering sub-6G and 60GHz. The antenna comprises a dielectric substrate, a broadband monopole, a compact microstripresonance unit, a millimeter wave decoupling patch array, a rectangular metal floor and a lumped port. The broadband monopole is printed on the upper surface of the dielectric substrate and is composed of an annular microstrip line and a microstrip feeder. The compact microstrip resonance unit is connected with the millimeter wave decoupling patch array and the microstrip feeder line; the millimeter wave decoupling patch array comprises millimeter wave patches, rectangular slots and decoupling microstrip lines, the rectangular slots are located in the millimeter wave patches, and the decoupling microstrip lines are located between the millimeter wave patches; the rectangular metal floor is printed on the lower surface of the dielectric substrate; and the lumped port is connected with themi",https://worldwide.espacenet.com/publicationDetails/biblio?CC=CN&NR=209948043&KC=U
EP2270839,EPO,METHOD FOR MANUFACTURING BONDED SUBSTRATE,20110105,SHINETSU CHEMICAL CO [JP],"Provided is a method for manufacturing a bonded substrate having an excellent thin film over the entire substrate surface, especially even at the vicinity of a bonded end portion. The method for manufacturing the bonded substrate wherein the thin film is provided on a second substrate has at least a step of forming an ion implanted layer by implanting from a surface of a first substrate, i.e., a semiconductor substrate, hydrogen ions or rare gas ions or both types of ions; a step of performing surface activation treatment to at least the first substrate surface wherein ions are implanted or to the bonding surface of the second substrate; a step of bonding the first substrate surface wherein the ions are implanted and the bonding surface of the second substrate with each other, under atmosphere having a humidity of 30% or less and/or a water quantity of 6g/m 3 or less; and a peeling step of separating the first substrate at the ion implanted layer and forming the first substrate in a th",https://worldwide.espacenet.com/publicationDetails/biblio?CC=EP&NR=2270839&KC=A1
WO2020016998,EPO,"DISPLAY DEVICE, DISPLAY DEVICE MANUFACTURING METHOD, DISPLAY DEVICE MANUFACTURING APPARATUS",20200123,SHARP KK [JP],"A display device (1) comprises a shared hole transport layer (6C) shared by a plurality of subpixels (2R, 2G, 2B) between an anode (4) and light emitting layers (8R, 8G, 8B), and an individual hole transport layer (6P) is individually provided for each of the plurality of subpixels between the common hole transport layer and the light emitting layers. The shared hole transport layer is configured using a first hole transport layer material. A first individual hole transport layer (6B) included in a first-color sub-pixel (2B) is configured using a second hole transport layer material. Second individual hole transport layers (6R, 6G) included in the second-color subpixels (2R, 2G) is configured using a mixed material of the first hole transport layer material and the second hole transport layer material.",https://worldwide.espacenet.com/publicationDetails/biblio?CC=WO&NR=2020016998&KC=A1
CN107809265,EPO,COFDM wireless broadband ad-hoc network module suitable for complex environment,20180316,POWER EMERGENCY CENTER OF STATE GRID SICHUAN ELECTRIC POWER CORP,"The invention discloses a COFDM wireless broadband ad-hoc network module suitable for a complex environment. The module comprises an enclosure and an ad-hoc network motherboard circuit; the ad-hoc network motherboard circuit comprises a radio frequency receiving unit, a radio frequency interference detection unit, a radio frequency transmitting unit, a broadband radio frequency receiving and sending unit, a baseband unit, an ad hoc network protocol unit, a user interface unit and a low ripple modulus isolation power supply system, the COFDM wireless broadband ad-hoc network module provides throughput of 24M-60Mbps for the system bandwidth and meets any 6-10 hops, the minimum bandwidth between any nodes is greater than the throughput of 3Mbp, the wireless signal baseband meets 300M-6G adjustable requirements and supports FDD frequency hopping and TDD multiplexing connection, the linearity of the wireless signals is high, the anti-interference ability of the automatic radio frequency int",https://worldwide.espacenet.com/publicationDetails/biblio?CC=CN&NR=107809265&KC=A
CN110828982,EPO,Antenna and shell of mobile terminal and mobile terminal,20200221,GREE ELECTRIC APPLIANCES INC ZHUHAI,"The invention relates to an antenna and a shell of a mobile terminal and the mobile terminal. The antenna comprises a frame and a main floor biased in the frame, and the frame is provided with a firstside edge. The first side edge of the frame is connected with the main floor through a grounding plate, and the other side edges of the frame are all or partially connected with the main floor. The first side edge is provided with a separation point and a feed point, and the frame is separated by the separation point, the grounding plate and the feed point to form a plurality of antennas. The separation point and the feed point are both arranged on the first side edge, and the grounding plate is also connected with the first side edge, so that the antennas formed on one side of the first sideedge in the frame can cover a large frequency range, can cover various frequencies such as GPS, Low Band, Middle Band and High Band, realize a wide frequency band, and meet the multimode (such as 2G,3G",https://worldwide.espacenet.com/publicationDetails/biblio?CC=CN&NR=110828982&KC=A
CN210123799,EPO,Four-unit MIMO antenna and electronic equipment,20200303,INPAQ TECH SUZHOU CO LTD,"The utility model discloses a four-unit MIMO antenna and an electronic device, the four-unit MIMO antenna is arranged in the electronic device, and comprises a first antenna unit and a fourth antennaunit which are symmetrically arranged and mutually connected, and a second antenna unit and a third antenna unit which are symmetrically arranged and mutually independent; the first antenna unit comprises a first substrate, a first antenna wire and a first grounding part, wherein the first antenna wire and the first grounding part are arranged above the first substrate. The first antenna wire is provided with a first feeding point. The second antenna unit comprises a second substrate, a second antenna wire and a second grounding part, wherein the second antenna wire and the second grounding part are arranged above the second substrate, and the second antenna wire is provided with a second feeding point. The antenna provided by the utility model overcomes the problem of narrow frequency band",https://worldwide.espacenet.com/publicationDetails/biblio?CC=CN&NR=210123799&KC=U
JP2016111012,EPO,SECONDARY BATTERY,20160620,SANYO ELECTRIC CO,"PROBLEM TO BE SOLVED: To provide a secondary battery excellent in the output characteristics.SOLUTION: Thickness of the terminal connection 6a of a positive electrode collector 6 is larger than that of the terminal connection of a negative electrode collector. The terminal connection 6a of a positive electrode collector 6 has a through hole 6g, and a positive electrode terminal 7 is inserted into the through hole 6g and caulked onto the terminal connection 6a. The terminal connection of a negative electrode collector has a through hole, and the negative terminal is inserted into the through hole and caulked onto the terminal connection. On the lower surface of the positive electrode terminal connection 6a, a recess 6f is formed around the through hole 6g, and the lower end 7x of positive electrode terminal 7 is arranged in a recess 6f.SELECTED DRAWING: Figure 5",https://worldwide.espacenet.com/publicationDetails/biblio?CC=JP&NR=2016111012&KC=A
CN110867652,EPO,"Sub-6G antenna structure, PCB and mobile terminal",20200306,HUIZHOU TCL MOBILE COMMUNICATION CO LTD,"The invention discloses a Sub-6G antenna structure, a PCB and a mobile terminal. The antenna structure comprises a first branch knot and a second branch knot; the first branch knot comprises an L-shaped arm and a first longitudinal arm extending outwards from the PCB, the first longitudinal arm is connected with the ground of the PCB, and one end of the L-shaped arm is connected with the tail endof the first longitudinal arm; the second branch knot is L-shaped, and one end of the second branch knot is connected with the antenna feed end of the PCB; at least one microstrip line is connected between the first longitudinal arm and the second branch knot. The PCB comprises the antenna structure, and the mobile terminal comprises the PCB. The antenna structure is mainly used for a Sub-6G frequency band of 5G communication equipment, can be directly added on the basis of a PCB component structure of an existing 4G mobile terminal, and meets the requirement of the mobile terminal for the ante",https://worldwide.espacenet.com/publicationDetails/biblio?CC=CN&NR=110867652&KC=A
US10588034,EPO,Antenna farm intelligent software defined networking enabled dynamic resource controller in advanced networks,20200310,AT & T MOBILITY II LLC [US],"Facilitating antenna farm intelligent software defined networking enabled dynamic resource controller networks (e.g., 5G, 6G, and beyond) is provided herein. Operations of a system can comprise evaluating a condition, the condition being at a mobile device, and a characteristic related to a defined network service associated with a connection to the mobile device. The operations can also comprise selectively modifying a quantity of antennas utilized to provide the connection to the mobile device based on the condition being determined to influence a level of service associated with the defined network service.",https://worldwide.espacenet.com/publicationDetails/biblio?CC=US&NR=10588034&KC=B1
CN110922766,EPO,"Silicone rubber material capable of repairing macroscopic scratches, preparation method and application thereof",20200327,UNIV SICHUAN,"The invention discloses a silicone rubber material capable of repairing macroscopic scratches, a preparation method and application thereof. The silicone rubber material comprises the following raw materials by weight: 60-90 parts of amino-terminated silicon rubber, 0.1-50 parts of conductive carbon black, 8-18 parts of diisocyanate, 3-13 parts of a cross-linking agent and 0.1-5 parts of nanoparticles with photo-thermal conversion effect. The preparation method includes: mixing the preparation raw materials with tetrahydrofuran to obtain a prepolymer, and controlling the use amount of the preparation raw materials at 0.1-0.6g/ml according to the volume of the tetrahydrofuran; and drying the prepolymer to obtain the silicone rubber material capable of repairing macroscopic scratches. The application comprises the application to repair of macroscopic scratches and application as 3D printing consumables. The invention has the beneficial effects that: the silicone rubber material has condu",https://worldwide.espacenet.com/publicationDetails/biblio?CC=CN&NR=110922766&KC=A
CN110920555,EPO,Active parking assist system for a motor vehicle,20200327,FORD GLOBAL TECH LLC,"The invention relates to an active parking assist system (4) for a motor vehicle (2), wherein the parking assist system (4) comprises a plurality of capacitive ultrasonic converters (6a, 6b, 6c, 6d, 6e, 6f, 6g, 6h, 6i, 6j, 6k, 6l, 6m, 6n, 6o) which are essentially spaced evenly in a horizontally circumferential manner outside the motor vehicle (2).",https://worldwide.espacenet.com/publicationDetails/biblio?CC=CN&NR=110920555&KC=A
CN110970717,EPO,Broadband Sub-6G external PCB antenna,20200407,AUDEN COMMUNICATIONS & MULTIMEDIA TECHNO KUNSHAN CO LTD,"The invention discloses a broadband Sub-6G external PCB antenna. The antenna comprises a PCB base material, wherein the surface of the PCB base material is provided with a radiation oscillator, and the surface of the PCB base material is provided with a concave loop oscillator; the radiation oscillator is provided with a resonance gap, and the radiation oscillator is connected with a central feeder line, wherein the central feeder line is provided with a balance-unbalance converter. According to the broadband Sub-6G external PCB antenna, the design is achieved in a limited antenna environmentunder the consideration of the requirements of the Sub-6G frequency band; the PCB base material can be effectively fixed by the positioning holes, thereby enhancing product firmness, and guaranteeingproduct consistency; the resonant frequency can be effectively adjusted, the product size is reduced, the product cost is reduced through the change of the depth of the resonant gap, the center feederli",https://worldwide.espacenet.com/publicationDetails/biblio?CC=CN&NR=110970717&KC=A
CN210296641,EPO,5G-sub-6G antenna for smart home,20200410,INPAQ TECH SUZHOU CO LTD,"The utility model discloses a 5G-sub-6G antenna for smart home, and belongs to the technical field of antennas. The 5G-sub-6G antenna comprises a PCB, an antenna bracket, an antenna and a plurality ofantenna interfaces, wherein the antenna support is arranged on the PCB, the antenna is arranged on the antenna support and is connected with the PCB, the antenna comprises a plurality of antenna structures, and each of the plurality of antenna structures is correspondingly connected with one of the antenna interfaces. The switchable smart home 5G-sub-6G antenna provided by the utility model has very high gain, and can meet the frequency band requirements of almost all common products.",https://worldwide.espacenet.com/publicationDetails/biblio?CC=CN&NR=210296641&KC=U
CN110994156,EPO,Antenna assembly and mobile terminal,20200410,HUIZHOU TCL MOBILE COMMUNICATION CO LTD,"The invention discloses an antenna assembly and a mobile terminal. The antenna assembly comprises a metal frame body, and at least one breakpoint is arranged in the metal frame body so as to divide the metal frame body into a plurality of frames; a plurality of antennas are integrated at each frame, the antennas integrated at the metal frame body comprise a low-frequency 2*2 MIMO antenna, a medium-high-frequency 4*4 MIMO antenna, a Sub-6G frequency band 4*4 MIMO antenna, a WIFI 2*2 MIMO antenna and a double-frequency GPS antenna; frequency bands of global operators can be covered, antenna performance is good, and mutual influence between antennas is small.",https://worldwide.espacenet.com/publicationDetails/biblio?CC=CN&NR=110994156&KC=A
CN210379418,EPO,PCB antenna,20200421,INPAQ TECH SUZHOU CO LTD,"The utility model discloses a PCB antenna. The PCB antenna comprises an antenna floor, an antenna radiator and a dielectric substrate arranged above the antenna floor. Wherein the antenna radiator comprises an antenna main body and a feed part communicated with the antenna main body, and the antenna main body comprises a first radiation part and a second radiation part; the first radiation part comprises a first body arranged on the front surface of the dielectric substrate, a second body and a third body connected with the tail end of the second body; the first radiation part further comprises a fourth body which is arranged on the reverse side of the dielectric substrate and connected with the third body; the tail end of the first body is provided with a ground feed point, and the tail end of the second body is provided with an antenna signal feed point. The second radiation part comprises a fifth body which is arranged on the antenna floor and is connected with the ground feed point",https://worldwide.espacenet.com/publicationDetails/biblio?CC=CN&NR=210379418&KC=U
CN111045287,EPO,Detection system of wide-angle camera module,20200421,GUANGDONG HONGJING OPTOELECTRONIC TECH INC,"The invention relates to a divisional application with an application number of 201710669852.3, and discloses a detection system of a wide-angle camera module. The detection system comprises a generation module, an adjustment module, an acquisition module and a determination module, the generation module comprises an acquisition unit and a generation unit; the acquisition unit comprises a first acquisition subunit, a second acquisition subunit, a first generation subunit, a second generation subunit, an adjustment subunit, a third generation subunit, a fourth generation subunit, a fifth generation subunit, a sixth generation subunit, a seventh generation subunit and an eighth generation subunit; and in a first grating curve, a second grating curve, an adjusted first grating curve or an adjusted second grating curve generated by the raw image of the view finding area, the wave crest width and the wave trough width are 1-3 pixel points. The detection accuracy of the test target plate ont",https://worldwide.espacenet.com/publicationDetails/biblio?CC=CN&NR=111045287&KC=A
US2020145129,EPO,PERFORMANCE BASED ON INFERRED USER EQUIPMENT DEVICE SPEED FOR ADVANCED NETWORKS,20200507,AT & T IP I LP [US],"Facilitating improved performance based on inferred user equipment device speed for advanced networks (e.g., 4G, 5G, 6G, and beyond) is provided herein. Operations of a system can comprise estimating a speed of a user equipment device based on a number of times that a layer indicator associated with the user equipment device changes during a defined period of time. The operations can also comprise selecting a multiple input transmission mode for a transmission to the user equipment device based on the speed of the user equipment device, resulting in a selected transmission mode. A closed loop multiple input transmission mode can be selected in response to the speed being below a defined speed. Alternatively, an open loop multiple input transmission mode can be selected in response to the speed being above the defined speed.",https://worldwide.espacenet.com/publicationDetails/biblio?CC=US&NR=2020145129&KC=A1
US2020145869,EPO,GENERATION OF DEMODULATION REFERENCE SIGNALS IN ADVANCED NETWORKS,20200507,AT & T IP I LP [US],"Facilitating generation of demodulation reference signals in advanced networks (e.g., 4G, 5G, 6G, and beyond) is provided herein. Operations of a system can comprise evaluating a capability of a mobile device and generating a demodulation reference signal sequence for the mobile device based on the capability of the mobile device. The demodulation reference signal sequence can be a first type based on the capability being a first capability and can be a second type based on the capability being a second capability.",https://worldwide.espacenet.com/publicationDetails/biblio?CC=US&NR=2020145869&KC=A1
WO2020092664,EPO,GENERATION OF DEMODULATION REFERENCE SIGNALS IN ADVANCED NETWORKS,20200507,AT & T IP I LP [US],"Facilitating generation of demodulation reference signals in advanced networks (e.g., 4G, 5G, 6G, and beyond) is provided herein. Operations of a system can comprise evaluating a capability of a mobile device and generating a demodulation reference signal sequence for the mobile device based on the capability of the mobile device. The demodulation reference signal sequence can be a first type based on the capability being a first capability and can be a second type based on the capability being a second capability.",https://worldwide.espacenet.com/publicationDetails/biblio?CC=WO&NR=2020092664&KC=A1
WO2020092660,EPO,IMPROVED PERFORMANCE BASED ON INFERRED USER EQUIPMENT DEVICE SPEED FOR ADVANCED NETWORKS,20200507,AT & T IP I LP [US],"Facilitating improved performance based on inferred user equipment device speed for advanced networks (e.g., 4G, 5G, 6G, and beyond) is provided herein. Operations of a system can comprise estimating a speed of a user equipment device based on a number of times that a layer indicator associated with the user equipment device changes during a defined period of time. The operations can also comprise selecting a multiple input transmission mode for a transmission to the user equipment device based on the speed of the user equipment device, resulting in a selected transmission mode. A closed loop multiple input transmission mode can be selected in response to the speed being below a defined speed. Alternatively, an open loop multiple input transmission mode can be selected in response to the speed being above the defined speed.",https://worldwide.espacenet.com/publicationDetails/biblio?CC=WO&NR=2020092660&KC=A1
CN111129716,EPO,5G mobile terminal antenna system working in millimeter wave and Sub-6G frequency band and application thereof,20200508,UNIV DALIAN TECH,"The invention provides a 5G mobile terminal antenna system working in a millimeter wave and a Sub-6G frequency band and an application thereof, and belongs to the technical field of wireless communication and antennas. The antenna system comprises a rectangular metal waveguide cavity, a rectangular radiation slot, a stepped radiation slot and a metal column, and a millimeter-wave antenna and a low-frequency-band antenna coexist and are integrated in a substrate and a frame of a mobile phone so that a win-win situation of a high gain and large coverage is realized without a phased array. The substrate integrated waveguide leaky-wave antenna can work together with a Sub-6G antenna, and the millimeter-wave antenna and the low-frequency antenna are integrated on a mobile phone frame at the same time so that a space is saved. In the invention, high coverage of the mobile terminal is realized through 12 leaky-wave antennas with different radiation directions, a traditional phased-array anten",https://worldwide.espacenet.com/publicationDetails/biblio?CC=CN&NR=111129716&KC=A
CN111130551,EPO,Buffer based on inductance frequency extension and sampling front-end circuit thereof,20200508,UNIV XIDIAN,"The invention discloses a buffer based on inductance frequency extension and a sampling front-end circuit thereof. The buffer based on inductance frequency extension comprises a matching circuit, a bias circuit, a source following circuit and an inductance frequency extension circuit, wherein the matching circuit is used for performing impedance matching processing on an input signal to obtain a matching processing signal; the bias circuit is connected with the matching circuit and is used for providing bias voltage for the source following circuit and inputting the matching processing signalinto the source following circuit; the source following circuit is connected with the bias circuit and is used for carrying out signal following processing on the matching processing signal accordingto the bias voltage to obtain a following processing signal; and the inductance frequency extension circuit is connected with the source following circuit and is used for performing signal compensation ",https://worldwide.espacenet.com/publicationDetails/biblio?CC=CN&NR=111130551&KC=A
