patent_id,source,title,date,assignee,abstract,link
JP2020074286,EPO,SECONDARY BATTERY,20200514,SANYO ELECTRIC CO,"To provide a secondary battery having an excellent output characteristic.SOLUTION: A thickness of a terminal connection part 6a of a positive electrode collector 6 is larger than that of a terminal connection part of a negative electrode collector. The terminal connection part 6a of the positive electrode collector 6 has a penetration hole 6g, and a positive electrode terminal 7 is caulked onto the terminal connection part 6a inserted into the penetration hole 6g, and the terminal connection part of the negative electrode collector has the penetration hole. The negative electrode terminal is caulked onto the terminal connection part so as to be inserted into the insertion hole, and a concave part 6f is formed in the circumference of the penetration hole 6g on a lower surface of the positive electrode terminal connection part 6a, and a lower end part 7x of the positive terminal 7 is arranged in the concave part 6f.SELECTED DRAWING: Figure 5",https://worldwide.espacenet.com/publicationDetails/biblio?CC=JP&NR=2020074286&KC=A
US2020153565,EPO,FACILITATING HYBRID AUTOMATIC REPEAT REQUEST RELIABILITY IMPROVEMENT FOR ADVANCED NETWORKS,20200514,AT & T IP I LP [US],"Facilitating hybrid automatic repeat request reliability improvement for advanced networks (e.g., 4G, 5G, 6G, and beyond) is provided herein. Operations of a system can comprise obtaining information related to a capability of a user equipment device and configuring the user equipment device with respect to control channel resources and a number of repetitions per slot based on the capability of the user equipment device. The operations can also comprise indicating the control channel resources and the number of repetitions per slot to the user equipment device via a control channel. Further, the operations can comprise detecting an acknowledgement, from the user equipment device, via an uplink control channel that comprises the control channel resources.",https://worldwide.espacenet.com/publicationDetails/biblio?CC=US&NR=2020153565&KC=A1
CN111162437,EPO,Random laser,20200515,UNIV BEIJING TECHNOLOGY,"The invention discloses a random laser. The random laser comprises a pumping source and a fiber network formed by randomly distributing a plurality of optical fibers, each optical fiber comprises a core layer and a cladding layer, the core layer is a PMMA layer (polymethyl methacrylate layer) doped with rhodamine 6G, the cladding layer is a PVDF layer (polyvinylidene fluoride layer), the refractive index of the cladding layer is larger than that of air, and the refractive index of the core layer is larger than that of the cladding layer. The pumping source carries out pumping in an oblique incidence mode, light is effectively coupled at the intersection point of optical fibers in the fiber network through evanescent waves to form a random annular resonant cavity, and stimulated radiation light is subjected to selective gain amplification in the random annular resonant cavity to form laser. According to the invention, while directional output of random laser is ensured, the situation of",https://worldwide.espacenet.com/publicationDetails/biblio?CC=CN&NR=111162437&KC=A
CN111162790,EPO,Buffer based on inductance frequency expansion and sampling front-end circuit of buffer,20200515,UNIV XIDIAN,"The invention discloses a buffer based on inductance frequency expansion and a sampling front-end circuit of the buffer. The buffer comprises a matching circuit, a biasing circuit and an inductance frequency-expanding source follower circuit; the matching circuit is used for performing impedance matching on an input signal to obtain a matching processing signal; the biasing circuit is connected with the matching circuit and is used for providing bias voltage for the inductance frequency-expanding source follower circuit and inputting the matching processing signal into the inductance frequency-expanding source follower circuit; and the inductance frequency-expanding source follower circuit is connected with the biasing circuit and is used for carrying out signal following and compensationprocessing on the matching processing signal according to the bias voltage to obtain an output signal. The buffer based on inductance frequency expansion provided by the invention has extremely high sa",https://worldwide.espacenet.com/publicationDetails/biblio?CC=CN&NR=111162790&KC=A
CN111193618,EPO,6G mobile communication system based on tensor calculation and data processing method thereof,20200522,UNIV SHANDONG,"The invention relates to a 6G mobile communication system based on tensor calculation and a data processing method thereof. The 6G mobile communication system comprises a high-dimensional informationsource, a tensor compression unit, sending equipment, a channel, receiving equipment, a tensor completion unit and an information sink which are connected in sequence. The tensor compression unit is used for compressing the high-dimensional information source to be transmitted to reduce the information redundancy of the high-dimensional information source. The tensor completion unit is used for supplementing information loss items caused by interference of the complete high-dimensional signals in the transmission process. According to the method, the problem of pain points in a future 6G mobile communication system is solved, compression and completion of high-dimensional data can be achieved, and a good effect is achieved. The method improves the capability of processing high-dimensionalda",https://worldwide.espacenet.com/publicationDetails/biblio?CC=CN&NR=111193618&KC=A
CN108389731,EPO,Method for preparing super-capacitor electrode material through elamine/thiourea and formaldehyde copolymerization method,20180810,UNIV QILU TECHNOLOGY,"The invention relates to a method for preparing a super-capacitor electrode material through an elamine/thiourea and formaldehyde copolymerization method. The method comprises the following preparation steps: enabling 2.8g of elamine and 17.6g of thiourea to be dissolved in 90ml of deionized water, uniformly stirring the mixture in a three-mouth flask for 0.5h, adding 12ml of formaldehyde, and stirring the mixture for 0.5h at an increased speed; slowly adding 0.4ml of concentrated hydrochloric acid through dripping, and performing the reaction for 3h under the temperature of 55 DEG C to obtainsuspending liquid with the milk white color; carrying out the centrifugation of a product: carrying out the centrifugation alternately through ethyl alcohol and deionized water till the liquid supernatant is neutral, and carrying out the drying for 8h; carrying out the carbonization of copolymer under the protection of argon under the temperature of 750 DEG C, and obtaining the super-capacitor ele",https://worldwide.espacenet.com/publicationDetails/biblio?CC=CN&NR=108389731&KC=A
US2020178320,EPO,NETWORK CORE SOFTWARE DEFINED NETWORKING ENABLED ONBOARDING OF MICRO SERVICES FOR AN ADVANCED WIRELESS COMMUNICATIONS SYSTEM,20200604,AT & T MOBILITY II LLC [US],"A network core software defined networking (SDN) enabled onboarding of microservices in a 6G network is provided to enable a one-time registration of a device with a network. Rather than having a core network facilitates establishing communications channels every time a device attaches or connects to the mobile network, the SDN enabled onboarding system disclosed herein can onboard the device, authenticate the device, register the device with the network, and determine addressing for the device. When the device reconnects to the network, the device has already been onboarded, and so the device does not need to go through these steps again, but can rather immediately start communicating with desired network service.",https://worldwide.espacenet.com/publicationDetails/biblio?CC=US&NR=2020178320&KC=A1
US2020177271,EPO,SYSTEM MODEL AND ARCHITECTURE FOR MOBILE INTEGRATED ACCESS AND BACKHAUL IN ADVANCED NETWORKS,20200604,AT & T IP I LP [US],"Facilitating operation and support of mobile relays based on an integrated access and backhaul concept for advanced networks (e.g., 4G, 5G, 6G, and beyond) is provided. An embodiment relates to a communication network architecture that can comprise a control plane architecture of a relay node device. The control plane architecture can comprise a star-type architecture. Further, the communication network architecture can comprise a user plane architecture of the relay node device. The user plane architecture can be separated from (or independent of) the control plane architecture. Further, the user plane architecture can comprise a multi-hop architecture. The relay node device can be configured to operate according to a fifth generation wireless network communication protocol, or other advanced communication protocols.",https://worldwide.espacenet.com/publicationDetails/biblio?CC=US&NR=2020177271&KC=A1
WO2020112295,EPO,SYSTEM MODEL AND ARCHITECTURE FOR MOBILE INTEGRATED ACCESS AND BACKHAUL IN ADVANCED NETWORKS,20200604,AT & T IP I LP [US],"Facilitating operation and support of mobile relays based on an integrated access and backhaul concept for advanced networks (e.g., 4G, 5G, 6G, and beyond) is provided. An embodiment relates to a communication network architecture that can comprise a control plane architecture of a relay node device. The control plane architecture can comprise a star-type architecture. Further, the communication network architecture can comprise a user plane architecture of the relay node device. The user plane architecture can be separated from (or independent of) the control plane architecture. Further, the user plane architecture can comprise a multi-hop architecture. The relay node device can be configured to operate according to a fifth generation wireless network communication protocol, or other advanced communication protocols.",https://worldwide.espacenet.com/publicationDetails/biblio?CC=WO&NR=2020112295&KC=A1
